[
  {
    "id": "os001",
    "subjectId": "os",
    "chapterId": "os-process",
    "chapterName": "进程、线程与调度",
    "chapterOrder": 1,
    "type": "single",
    "stem": "在“进程、线程与调度”主题中，关于“进程”，下列描述哪项正确？",
    "options": [
      {
        "id": "A",
        "label": "A",
        "text": "拥有独立地址空间和资源的程序执行实例"
      },
      {
        "id": "B",
        "label": "B",
        "text": "进程内可被调度的执行单元并共享进程资源"
      },
      {
        "id": "C",
        "label": "C",
        "text": "记录进程标识、状态、上下文和资源信息"
      },
      {
        "id": "D",
        "label": "D",
        "text": "保存当前执行状态并恢复另一任务状态"
      }
    ],
    "correctOptionIds": [
      "A"
    ],
    "explanation": "进程：拥有独立地址空间和资源的程序执行实例。",
    "difficulty": 1,
    "tags": [
      "进程、线程与调度",
      "进程"
    ],
    "images": [],
    "examScopes": [
      "408"
    ],
    "status": "active",
    "version": 2
  },
  {
    "id": "os002",
    "subjectId": "os",
    "chapterId": "os-process",
    "chapterName": "进程、线程与调度",
    "chapterOrder": 1,
    "type": "single",
    "stem": "在“进程、线程与调度”主题中，下列哪个术语与“进程内可被调度的执行单元并共享进程资源”相符？",
    "options": [
      {
        "id": "A",
        "label": "A",
        "text": "PCB"
      },
      {
        "id": "B",
        "label": "B",
        "text": "上下文切换"
      },
      {
        "id": "C",
        "label": "C",
        "text": "时间片轮转"
      },
      {
        "id": "D",
        "label": "D",
        "text": "线程"
      }
    ],
    "correctOptionIds": [
      "D"
    ],
    "explanation": "线程：进程内可被调度的执行单元并共享进程资源。",
    "difficulty": 1,
    "tags": [
      "进程、线程与调度",
      "线程"
    ],
    "images": [],
    "examScopes": [
      "408"
    ],
    "status": "active",
    "version": 2
  },
  {
    "id": "os003",
    "subjectId": "os",
    "chapterId": "os-process",
    "chapterName": "进程、线程与调度",
    "chapterOrder": 1,
    "type": "single",
    "stem": "在“进程、线程与调度”主题中，关于“PCB”，下列描述哪项正确？",
    "options": [
      {
        "id": "A",
        "label": "A",
        "text": "按固定时间片循环调度就绪进程"
      },
      {
        "id": "B",
        "label": "B",
        "text": "结果依赖多个执行流不可控的交错顺序"
      },
      {
        "id": "C",
        "label": "C",
        "text": "记录进程标识、状态、上下文和资源信息"
      },
      {
        "id": "D",
        "label": "D",
        "text": "保存当前执行状态并恢复另一任务状态"
      }
    ],
    "correctOptionIds": [
      "C"
    ],
    "explanation": "PCB：记录进程标识、状态、上下文和资源信息。",
    "difficulty": 1,
    "tags": [
      "进程、线程与调度",
      "PCB"
    ],
    "images": [],
    "examScopes": [
      "408"
    ],
    "status": "active",
    "version": 2
  },
  {
    "id": "os004",
    "subjectId": "os",
    "chapterId": "os-process",
    "chapterName": "进程、线程与调度",
    "chapterOrder": 1,
    "type": "multiple",
    "stem": "在“进程、线程与调度”中围绕“上下文切换”及相关概念，下列“术语—说明”配对中哪些正确？",
    "options": [
      {
        "id": "A",
        "label": "A",
        "text": "临界区：结果依赖多个执行流不可控的交错顺序"
      },
      {
        "id": "B",
        "label": "B",
        "text": "上下文切换：保存当前执行状态并恢复另一任务状态"
      },
      {
        "id": "C",
        "label": "C",
        "text": "时间片轮转：按固定时间片循环调度就绪进程"
      },
      {
        "id": "D",
        "label": "D",
        "text": "竞态条件：访问共享资源且需要互斥执行的代码段"
      }
    ],
    "correctOptionIds": [
      "B",
      "C"
    ],
    "explanation": "正确配对是“上下文切换—保存当前执行状态并恢复另一任务状态”和“时间片轮转—按固定时间片循环调度就绪进程”。",
    "difficulty": 2,
    "tags": [
      "进程、线程与调度",
      "上下文切换"
    ],
    "images": [],
    "examScopes": [
      "408"
    ],
    "status": "active",
    "version": 2
  },
  {
    "id": "os005",
    "subjectId": "os",
    "chapterId": "os-process",
    "chapterName": "进程、线程与调度",
    "chapterOrder": 1,
    "type": "judge",
    "stem": "时间片轮转中，时间片缩短通常能改善交互响应，但过短会增加上下文切换开销，因此并非越短越好。",
    "options": [
      {
        "id": "A",
        "label": "A",
        "text": "正确"
      },
      {
        "id": "B",
        "label": "B",
        "text": "错误"
      }
    ],
    "correctOptionIds": [
      "A"
    ],
    "explanation": "较短时间片让就绪进程更快获得 CPU，但切换次数也随之增加。调度设计需要在响应时间和切换开销之间权衡。",
    "difficulty": 3,
    "tags": [
      "进程、线程与调度",
      "时间片轮转",
      "调度开销"
    ],
    "images": [],
    "examScopes": [
      "408"
    ],
    "status": "active",
    "version": 2
  },
  {
    "id": "os006",
    "subjectId": "os",
    "chapterId": "os-process",
    "chapterName": "进程、线程与调度",
    "chapterOrder": 1,
    "type": "single",
    "stem": "同一应用需要隔离故障与地址空间：一个执行实例越界写内存时，不应直接破坏另一个实例的用户地址空间。更符合该要求的基本单位是什么？",
    "options": [
      {
        "id": "A",
        "label": "A",
        "text": "同一进程内的两个线程"
      },
      {
        "id": "B",
        "label": "B",
        "text": "两个独立进程"
      },
      {
        "id": "C",
        "label": "C",
        "text": "同一个临界区"
      },
      {
        "id": "D",
        "label": "D",
        "text": "同一个文件描述符"
      }
    ],
    "correctOptionIds": [
      "B"
    ],
    "explanation": "独立进程通常拥有彼此隔离的虚拟地址空间；同一进程内线程共享该进程的地址空间，隔离性较弱。",
    "difficulty": 2,
    "tags": [
      "进程、线程与调度",
      "进程",
      "地址空间隔离"
    ],
    "images": [],
    "examScopes": [
      "408"
    ],
    "status": "active",
    "version": 2
  },
  {
    "id": "os007",
    "subjectId": "os",
    "chapterId": "os-process",
    "chapterName": "进程、线程与调度",
    "chapterOrder": 1,
    "type": "single",
    "stem": "同一进程的两个线程之间交换大量内存数据，通常不必经过跨进程复制，主要原因是什么？",
    "options": [
      {
        "id": "A",
        "label": "A",
        "text": "线程共享所属进程的地址空间"
      },
      {
        "id": "B",
        "label": "B",
        "text": "线程各自拥有完整独立地址空间"
      },
      {
        "id": "C",
        "label": "C",
        "text": "线程不能被调度"
      },
      {
        "id": "D",
        "label": "D",
        "text": "线程只在内核中存在"
      }
    ],
    "correctOptionIds": [
      "A"
    ],
    "explanation": "线程有各自的执行上下文和栈，但共享进程的代码、全局数据和地址空间，因此可直接访问约定的共享对象。",
    "difficulty": 2,
    "tags": [
      "进程、线程与调度",
      "线程",
      "共享地址空间"
    ],
    "images": [],
    "examScopes": [
      "408"
    ],
    "status": "active",
    "version": 2
  },
  {
    "id": "os008",
    "subjectId": "os",
    "chapterId": "os-process",
    "chapterName": "进程、线程与调度",
    "chapterOrder": 1,
    "type": "single",
    "stem": "进程被抢占后稍后继续运行，内核恢复其程序计数器、寄存器和调度状态时，主要依据哪类内核数据结构？",
    "options": [
      {
        "id": "A",
        "label": "A",
        "text": "PCB"
      },
      {
        "id": "B",
        "label": "B",
        "text": "用户栈中的字符串"
      },
      {
        "id": "C",
        "label": "C",
        "text": "目录项"
      },
      {
        "id": "D",
        "label": "D",
        "text": "磁盘分区表"
      }
    ],
    "correctOptionIds": [
      "A"
    ],
    "explanation": "PCB 保存进程标识、状态、CPU 上下文和资源关联等信息，是调度与上下文恢复的重要依据。",
    "difficulty": 2,
    "tags": [
      "进程、线程与调度",
      "PCB",
      "上下文恢复"
    ],
    "images": [],
    "examScopes": [
      "408"
    ],
    "status": "active",
    "version": 2
  },
  {
    "id": "os009",
    "subjectId": "os",
    "chapterId": "os-process",
    "chapterName": "进程、线程与调度",
    "chapterOrder": 1,
    "type": "multiple",
    "stem": "关于进程或线程的上下文切换，下列哪些描述正确？",
    "options": [
      {
        "id": "A",
        "label": "A",
        "text": "需要保存当前执行流的寄存器等状态，并恢复另一执行流的状态"
      },
      {
        "id": "B",
        "label": "B",
        "text": "会产生调度与缓存局部性方面的额外开销"
      },
      {
        "id": "C",
        "label": "C",
        "text": "同一进程内线程切换通常不需要切换到另一个进程地址空间"
      },
      {
        "id": "D",
        "label": "D",
        "text": "必须复制当前进程的全部物理内存后才能完成"
      }
    ],
    "correctOptionIds": [
      "A",
      "B",
      "C"
    ],
    "explanation": "上下文切换保存和恢复执行状态，并可能影响缓存、TLB 等局部性。同进程线程共享地址空间；切换不需要复制整个物理内存。",
    "difficulty": 3,
    "tags": [
      "进程、线程与调度",
      "上下文切换",
      "线程"
    ],
    "images": [],
    "examScopes": [
      "408"
    ],
    "status": "active",
    "version": 2
  },
  {
    "id": "os010",
    "subjectId": "os",
    "chapterId": "os-process",
    "chapterName": "进程、线程与调度",
    "chapterOrder": 1,
    "type": "judge",
    "stem": "辨析判断：时间片轮转是指“结果依赖多个执行流不可控的交错顺序”。",
    "options": [
      {
        "id": "A",
        "label": "A",
        "text": "正确"
      },
      {
        "id": "B",
        "label": "B",
        "text": "错误"
      }
    ],
    "correctOptionIds": [
      "B"
    ],
    "explanation": "时间片轮转的准确含义是：按固定时间片循环调度就绪进程。",
    "difficulty": 2,
    "tags": [
      "进程、线程与调度",
      "时间片轮转"
    ],
    "images": [],
    "examScopes": [
      "408"
    ],
    "status": "active",
    "version": 2
  },
  {
    "id": "os011",
    "subjectId": "os",
    "chapterId": "os-sync",
    "chapterName": "同步与死锁",
    "chapterOrder": 2,
    "type": "single",
    "stem": "在“同步与死锁”主题中，下列哪个术语与“结果依赖多个执行流不可控的交错顺序”相符？",
    "options": [
      {
        "id": "A",
        "label": "A",
        "text": "互斥锁"
      },
      {
        "id": "B",
        "label": "B",
        "text": "信号量"
      },
      {
        "id": "C",
        "label": "C",
        "text": "竞态条件"
      },
      {
        "id": "D",
        "label": "D",
        "text": "临界区"
      }
    ],
    "correctOptionIds": [
      "C"
    ],
    "explanation": "竞态条件：结果依赖多个执行流不可控的交错顺序。",
    "difficulty": 1,
    "tags": [
      "同步与死锁",
      "竞态条件"
    ],
    "images": [],
    "examScopes": [
      "408"
    ],
    "status": "active",
    "version": 2
  },
  {
    "id": "os012",
    "subjectId": "os",
    "chapterId": "os-sync",
    "chapterName": "同步与死锁",
    "chapterOrder": 2,
    "type": "single",
    "stem": "在“同步与死锁”主题中，关于“临界区”，下列描述哪项正确？",
    "options": [
      {
        "id": "A",
        "label": "A",
        "text": "多个任务循环等待对方持有的资源而无法推进"
      },
      {
        "id": "B",
        "label": "B",
        "text": "访问共享资源且需要互斥执行的代码段"
      },
      {
        "id": "C",
        "label": "C",
        "text": "保证同一时刻只有一个执行流进入受保护区域"
      },
      {
        "id": "D",
        "label": "D",
        "text": "用整数计数和原子操作实现同步或资源管理"
      }
    ],
    "correctOptionIds": [
      "B"
    ],
    "explanation": "临界区：访问共享资源且需要互斥执行的代码段。",
    "difficulty": 1,
    "tags": [
      "同步与死锁",